,Title,Link,Price,Stock
662,Outlander (Outlander #1),outlander-outlander-1_338/index.html,19.67,In stock
663,"Orchestra of Exiles: The Story of Bronislaw Huberman, the Israel Philharmonic, and the One Thousand Jews He Saved from Nazi Horrors",orchestra-of-exiles-the-story-of-bronislaw-huberman-the-israel-philharmonic-and-the-one-thousand-jews-he-saved-from-nazi-horrors_337/index.html,12.36,In stock
664,No One Here Gets Out Alive,no-one-here-gets-out-alive_336/index.html,20.02,In stock
665,Night Shift (Night Shift #1-20),night-shift-night-shift-1-20_335/index.html,12.75,In stock
666,Needful Things,needful-things_334/index.html,47.51,In stock
667,Mockingjay (The Hunger Games #3),mockingjay-the-hunger-games-3_333/index.html,20.44,In stock
668,Misery,misery_332/index.html,34.79,In stock
669,Little Women (Little Women #1),little-women-little-women-1_331/index.html,28.07,In stock
670,It,it_330/index.html,25.01,In stock
671,Harry Potter and the Sorcerer's Stone (Harry Potter #1),harry-potter-and-the-sorcerers-stone-harry-potter-1_329/index.html,13.90,In stock
672,Harry Potter and the Prisoner of Azkaban (Harry Potter #3),harry-potter-and-the-prisoner-of-azkaban-harry-potter-3_328/index.html,24.17,In stock
673,Harry Potter and the Order of the Phoenix (Harry Potter #5),harry-potter-and-the-order-of-the-phoenix-harry-potter-5_327/index.html,31.63,In stock
674,Harry Potter and the Half-Blood Prince (Harry Potter #6),harry-potter-and-the-half-blood-prince-harry-potter-6_326/index.html,48.75,In stock
675,Harry Potter and the Chamber of Secrets (Harry Potter #2),harry-potter-and-the-chamber-of-secrets-harry-potter-2_325/index.html,14.74,In stock
676,Gone with the Wind,gone-with-the-wind_324/index.html,32.49,In stock
677,God Is Not Great: How Religion Poisons Everything,god-is-not-great-how-religion-poisons-everything_323/index.html,27.80,In stock
678,Girl With a Pearl Earring,girl-with-a-pearl-earring_322/index.html,26.77,In stock
679,"Fruits Basket, Vol. 4 (Fruits Basket #4)",fruits-basket-vol-4-fruits-basket-4_321/index.html,50.44,In stock
680,Far From True (Promise Falls Trilogy #2),far-from-true-promise-falls-trilogy-2_320/index.html,34.93,In stock
681,Dark Lover (Black Dagger Brotherhood #1),dark-lover-black-dagger-brotherhood-1_319/index.html,12.87,In stock
682,Confessions of a Shopaholic (Shopaholic #1),confessions-of-a-shopaholic-shopaholic-1_318/index.html,48.94,In stock
683,Changing the Game (Play by Play #2),changing-the-game-play-by-play-2_317/index.html,13.38,In stock
684,Candide,candide_316/index.html,58.63,In stock
685,Can You Keep a Secret?,can-you-keep-a-secret_315/index.html,21.94,In stock
686,Atlas Shrugged,atlas-shrugged_314/index.html,26.58,In stock
687,Animal Farm,animal-farm_313/index.html,57.22,In stock
688,A Walk to Remember,a-walk-to-remember_312/index.html,56.43,In stock
689,A New Earth: Awakening to Your Life's Purpose,a-new-earth-awakening-to-your-lifes-purpose_311/index.html,55.65,In stock
690,"A History of God: The 4,000-Year Quest of Judaism, Christianity, and Islam",a-history-of-god-the-4000-year-quest-of-judaism-christianity-and-islam_310/index.html,27.62,In stock
691,'Salem's Lot,salems-lot_309/index.html,49.56,In stock
692,Zero History (Blue Ant #3),zero-history-blue-ant-3_308/index.html,34.77,In stock
693,Wuthering Heights,wuthering-heights_307/index.html,17.73,In stock
694,World War Z: An Oral History of the Zombie War,world-war-z-an-oral-history-of-the-zombie-war_306/index.html,21.80,In stock
695,Wild: From Lost to Found on the Pacific Crest Trail,wild-from-lost-to-found-on-the-pacific-crest-trail_305/index.html,46.02,In stock
696,"Where'd You Go, Bernadette",whered-you-go-bernadette_304/index.html,18.13,In stock
697,When You Are Engulfed in Flames,when-you-are-engulfed-in-flames_303/index.html,30.89,In stock
698,We the People: The Modern-Day Figures Who Have Reshaped and Affirmed the Founding Fathers' Vision of America,we-the-people-the-modern-day-figures-who-have-reshaped-and-affirmed-the-founding-fathers-vision-of-america_302/index.html,31.95,In stock
699,We Are All Completely Beside Ourselves,we-are-all-completely-beside-ourselves_301/index.html,24.04,In stock
700,Walk the Edge (Thunder Road #2),walk-the-edge-thunder-road-2_300/index.html,32.36,In stock
701,Voyager (Outlander #3),voyager-outlander-3_299/index.html,21.07,In stock
702,Very Good Lives: The Fringe Benefits of Failure and the Importance of Imagination,very-good-lives-the-fringe-benefits-of-failure-and-the-importance-of-imagination_298/index.html,50.66,In stock
703,Vegan Vegetarian Omnivore: Dinner for Everyone at the Table,vegan-vegetarian-omnivore-dinner-for-everyone-at-the-table_297/index.html,13.66,In stock
704,"Unstuffed: Decluttering Your Home, Mind, and Soul",unstuffed-decluttering-your-home-mind-and-soul_296/index.html,58.09,In stock
705,Under the Banner of Heaven: A Story of Violent Faith,under-the-banner-of-heaven-a-story-of-violent-faith_295/index.html,30.00,In stock
706,Two Boys Kissing,two-boys-kissing_294/index.html,32.74,In stock
707,Twilight (Twilight #1),twilight-twilight-1_293/index.html,41.93,In stock
708,Twenties Girl,twenties-girl_292/index.html,42.80,In stock
709,"Trespassing Across America: One Man's Epic, Never-Done-Before (and Sort of Illegal) Hike Across the Heartland",trespassing-across-america-one-mans-epic-never-done-before-and-sort-of-illegal-hike-across-the-heartland_291/index.html,53.51,In stock
710,Three-Martini Lunch,three-martini-lunch_290/index.html,23.21,In stock
711,"Thinking, Fast and Slow",thinking-fast-and-slow_289/index.html,21.14,In stock
712,The Wild Robot,the-wild-robot_288/index.html,56.07,In stock
713,"The Wicked + The Divine, Vol. 3: Commercial Suicide (The Wicked + The Divine)",the-wicked-the-divine-vol-3-commercial-suicide-the-wicked-the-divine_287/index.html,14.41,In stock
714,The Undomestic Goddess,the-undomestic-goddess_286/index.html,45.75,In stock
715,The Travelers,the-travelers_285/index.html,15.77,In stock
716,The Tipping Point: How Little Things Can Make a Big Difference,the-tipping-point-how-little-things-can-make-a-big-difference_284/index.html,10.02,In stock
717,The Thing About Jellyfish,the-thing-about-jellyfish_283/index.html,48.77,In stock
718,The Stand,the-stand_282/index.html,57.86,In stock
719,The Smitten Kitchen Cookbook,the-smitten-kitchen-cookbook_281/index.html,23.59,In stock
720,The Silkworm (Cormoran Strike #2),the-silkworm-cormoran-strike-2_280/index.html,23.05,In stock
721,"The Sandman, Vol. 3: Dream Country (The Sandman (volumes) #3)",the-sandman-vol-3-dream-country-the-sandman-volumes-3_279/index.html,55.55,In stock
722,The Rose & the Dagger (The Wrath and the Dawn #2),the-rose-the-dagger-the-wrath-and-the-dawn-2_278/index.html,58.64,In stock
723,The Road to Little Dribbling: Adventures of an American in Britain (Notes From a Small Island #2),the-road-to-little-dribbling-adventures-of-an-american-in-britain-notes-from-a-small-island-2_277/index.html,23.21,In stock
724,The Rise of Theodore Roosevelt (Theodore Roosevelt #1),the-rise-of-theodore-roosevelt-theodore-roosevelt-1_276/index.html,42.57,In stock
725,The Restaurant at the End of the Universe (Hitchhiker's Guide to the Galaxy #2),the-restaurant-at-the-end-of-the-universe-hitchhikers-guide-to-the-galaxy-2_275/index.html,10.92,In stock
726,The Rest Is Noise: Listening to the Twentieth Century,the-rest-is-noise-listening-to-the-twentieth-century_274/index.html,34.77,In stock
727,The Red Tent,the-red-tent_273/index.html,35.66,In stock
728,The Purpose Driven Life: What on Earth Am I Here for?,the-purpose-driven-life-what-on-earth-am-i-here-for_272/index.html,37.19,In stock
729,The Purest Hook (Second Circle Tattoos #3),the-purest-hook-second-circle-tattoos-3_271/index.html,12.25,In stock
730,The Picture of Dorian Gray,the-picture-of-dorian-gray_270/index.html,29.70,In stock
731,The Paris Wife,the-paris-wife_269/index.html,36.80,In stock
732,The Obsession,the-obsession_268/index.html,45.43,In stock
733,The Nightingale,the-nightingale_267/index.html,26.26,In stock
734,The New Guy (and Other Senior Year Distractions),the-new-guy-and-other-senior-year-distractions_266/index.html,44.92,In stock
735,The Nanny Diaries (Nanny #1),the-nanny-diaries-nanny-1_265/index.html,52.53,In stock
736,The Name of God is Mercy,the-name-of-god-is-mercy_264/index.html,37.25,In stock
737,The Maze Runner (The Maze Runner #1),the-maze-runner-the-maze-runner-1_263/index.html,20.93,In stock
738,The Lover's Dictionary,the-lovers-dictionary_262/index.html,58.09,In stock
739,The Lonely Ones,the-lonely-ones_261/index.html,43.59,In stock
740,The Lean Startup: How Today's Entrepreneurs Use Continuous Innovation to Create Radically Successful Businesses,the-lean-startup-how-todays-entrepreneurs-use-continuous-innovation-to-create-radically-successful-businesses_260/index.html,33.92,In stock
741,The Last Painting of Sara de Vos,the-last-painting-of-sara-de-vos_259/index.html,55.55,In stock
742,"The Land of 10,000 Madonnas",the-land-of-10000-madonnas_258/index.html,29.64,In stock
743,The Infinities,the-infinities_257/index.html,27.41,In stock
744,The Husband's Secret,the-husbands-secret_256/index.html,52.51,In stock
745,The Hitchhiker's Guide to the Galaxy (Hitchhiker's Guide to the Galaxy #1),the-hitchhikers-guide-to-the-galaxy-hitchhikers-guide-to-the-galaxy-1_255/index.html,47.80,In stock
746,The Guns of August,the-guns-of-august_254/index.html,14.54,In stock
747,The Guernsey Literary and Potato Peel Pie Society,the-guernsey-literary-and-potato-peel-pie-society_253/index.html,49.53,In stock
748,The Goldfinch,the-goldfinch_252/index.html,43.58,In stock
749,The Giver (The Giver Quartet #1),the-giver-the-giver-quartet-1_251/index.html,12.30,In stock
750,The Girl with All the Gifts,the-girl-with-all-the-gifts_250/index.html,49.47,In stock
751,The Girl Who Played with Fire (Millennium Trilogy #2),the-girl-who-played-with-fire-millennium-trilogy-2_249/index.html,22.14,In stock
752,The Girl Who Kicked the Hornet's Nest (Millennium Trilogy #3),the-girl-who-kicked-the-hornets-nest-millennium-trilogy-3_248/index.html,57.48,In stock
753,The Exiled,the-exiled_247/index.html,43.45,In stock
754,"The End of Faith: Religion, Terror, and the Future of Reason",the-end-of-faith-religion-terror-and-the-future-of-reason_246/index.html,22.13,In stock
755,"The Elegant Universe: Superstrings, Hidden Dimensions, and the Quest for the Ultimate Theory",the-elegant-universe-superstrings-hidden-dimensions-and-the-quest-for-the-ultimate-theory_245/index.html,13.03,In stock
756,"The Disappearing Spoon: And Other True Tales of Madness, Love, and the History of the World from the Periodic Table of the Elements",the-disappearing-spoon-and-other-true-tales-of-madness-love-and-the-history-of-the-world-from-the-periodic-table-of-the-elements_244/index.html,57.35,In stock
757,The Devil Wears Prada (The Devil Wears Prada #1),the-devil-wears-prada-the-devil-wears-prada-1_243/index.html,44.29,In stock
758,The Demon-Haunted World: Science as a Candle in the Dark,the-demon-haunted-world-science-as-a-candle-in-the-dark_242/index.html,52.25,In stock
759,The Day the Crayons Came Home (Crayons),the-day-the-crayons-came-home-crayons_241/index.html,26.33,In stock
760,The Da Vinci Code (Robert Langdon #2),the-da-vinci-code-robert-langdon-2_240/index.html,22.96,In stock
761,The Cuckoo's Calling (Cormoran Strike #1),the-cuckoos-calling-cormoran-strike-1_239/index.html,19.21,In stock
762,The Complete Stories and Poems (The Works of Edgar Allan Poe [Cameo Edition]),the-complete-stories-and-poems-the-works-of-edgar-allan-poe-cameo-edition_238/index.html,26.78,In stock
763,The Complete Poems,the-complete-poems_237/index.html,41.32,In stock
764,The Catcher in the Rye,the-catcher-in-the-rye_236/index.html,24.55,In stock
765,The Cat in the Hat (Beginner Books B-1),the-cat-in-the-hat-beginner-books-b-1_235/index.html,16.26,In stock
766,The Case for Christ (Cases for Christianity),the-case-for-christ-cases-for-christianity_234/index.html,47.84,In stock
767,The Book Thief,the-book-thief_233/index.html,53.49,In stock
768,The Book of Basketball: The NBA According to The Sports Guy,the-book-of-basketball-the-nba-according-to-the-sports-guy_232/index.html,44.84,In stock
769,The Blind Side: Evolution of a Game,the-blind-side-evolution-of-a-game_231/index.html,53.71,In stock
770,The Autobiography of Malcolm X,the-autobiography-of-malcolm-x_230/index.html,23.43,In stock
771,"The Art of Simple Food: Notes, Lessons, and Recipes from a Delicious Revolution",the-art-of-simple-food-notes-lessons-and-recipes-from-a-delicious-revolution_229/index.html,34.32,In stock
772,The Art of Fielding,the-art-of-fielding_228/index.html,22.10,In stock
773,"Surely You're Joking, Mr. Feynman!: Adventures of a Curious Character",surely-youre-joking-mr-feynman-adventures-of-a-curious-character_227/index.html,25.83,In stock
774,Stiff: The Curious Lives of Human Cadavers,stiff-the-curious-lives-of-human-cadavers_226/index.html,36.74,In stock
775,Spilled Milk: Based on a True Story,spilled-milk-based-on-a-true-story_225/index.html,49.51,In stock
776,Something Borrowed (Darcy & Rachel #1),something-borrowed-darcy-rachel-1_224/index.html,48.96,In stock
777,Something Blue (Darcy & Rachel #2),something-blue-darcy-rachel-2_223/index.html,54.62,In stock
778,Soldier (Talon #3),soldier-talon-3_222/index.html,24.72,In stock
779,Shopaholic & Baby (Shopaholic #5),shopaholic-baby-shopaholic-5_221/index.html,46.45,In stock
780,Seven Days in the Art World,seven-days-in-the-art-world_220/index.html,52.33,In stock
781,Seven Brief Lessons on Physics,seven-brief-lessons-on-physics_219/index.html,30.60,In stock
782,Scarlet (The Lunar Chronicles #2),scarlet-the-lunar-chronicles-2_218/index.html,14.57,In stock
783,Sarah's Key,sarahs-key_217/index.html,46.29,In stock
784,"Saga, Volume 3 (Saga (Collected Editions) #3)",saga-volume-3-saga-collected-editions-3_216/index.html,21.57,In stock
785,Running with Scissors,running-with-scissors_215/index.html,12.91,In stock
786,Rogue Lawyer (Rogue Lawyer #1),rogue-lawyer-rogue-lawyer-1_214/index.html,50.11,In stock
787,"Rise of the Rocket Girls: The Women Who Propelled Us, from Missiles to the Moon to Mars",rise-of-the-rocket-girls-the-women-who-propelled-us-from-missiles-to-the-moon-to-mars_213/index.html,41.67,In stock
788,Rework,rework_212/index.html,44.88,In stock
789,Reservations for Two,reservations-for-two_211/index.html,11.10,In stock
790,Red: The True Story of Red Riding Hood,red-the-true-story-of-red-riding-hood_210/index.html,28.54,In stock
791,Ready Player One,ready-player-one_209/index.html,19.07,In stock
792,Quiet: The Power of Introverts in a World That Can't Stop Talking,quiet-the-power-of-introverts-in-a-world-that-cant-stop-talking_208/index.html,43.55,In stock
793,Prodigy: The Graphic Novel (Legend: The Graphic Novel #2),prodigy-the-graphic-novel-legend-the-graphic-novel-2_207/index.html,43.63,In stock
794,Persepolis: The Story of a Childhood (Persepolis #1-2),persepolis-the-story-of-a-childhood-persepolis-1-2_206/index.html,39.13,In stock
795,Packing for Mars: The Curious Science of Life in the Void,packing-for-mars-the-curious-science-of-life-in-the-void_205/index.html,56.68,In stock
796,Outliers: The Story of Success,outliers-the-story-of-success_204/index.html,14.16,In stock
797,Original Fake,original-fake_203/index.html,31.45,In stock
798,Orange Is the New Black,orange-is-the-new-black_202/index.html,24.61,In stock
799,One for the Money (Stephanie Plum #1),one-for-the-money-stephanie-plum-1_201/index.html,32.87,In stock
800,Notes from a Small Island (Notes From a Small Island #1),notes-from-a-small-island-notes-from-a-small-island-1_200/index.html,40.17,In stock
801,Night (The Night Trilogy #1),night-the-night-trilogy-1_199/index.html,13.51,In stock
802,Neither Here nor There: Travels in Europe,neither-here-nor-there-travels-in-europe_198/index.html,38.95,In stock
803,Naked,naked_197/index.html,31.69,In stock
804,Morning Star (Red Rising #3),morning-star-red-rising-3_196/index.html,29.40,In stock
805,"Miracles from Heaven: A Little Girl, Her Journey to Heaven, and Her Amazing Story of Healing",miracles-from-heaven-a-little-girl-her-journey-to-heaven-and-her-amazing-story-of-healing_195/index.html,57.83,In stock
806,Midnight Riot (Peter Grant/ Rivers of London - books #1),midnight-riot-peter-grant-rivers-of-london-books-1_194/index.html,55.46,In stock
807,Me Talk Pretty One Day,me-talk-pretty-one-day_193/index.html,57.60,In stock
808,Manuscript Found in Accra,manuscript-found-in-accra_192/index.html,34.98,In stock
809,Lust & Wonder,lust-wonder_191/index.html,11.87,In stock
810,Lila (Gilead #3),lila-gilead-3_190/index.html,12.47,In stock
811,"Life, the Universe and Everything (Hitchhiker's Guide to the Galaxy #3)",life-the-universe-and-everything-hitchhikers-guide-to-the-galaxy-3_189/index.html,33.26,In stock
812,Life Without a Recipe,life-without-a-recipe_188/index.html,59.04,In stock
813,Life After Life,life-after-life_187/index.html,26.13,In stock
814,Letter to a Christian Nation,letter-to-a-christian-nation_186/index.html,22.20,In stock
815,Let's Pretend This Never Happened: A Mostly True Memoir,lets-pretend-this-never-happened-a-mostly-true-memoir_185/index.html,45.11,In stock
816,Legend (Legend #1),legend-legend-1_184/index.html,43.69,In stock
817,"Lean In: Women, Work, and the Will to Lead",lean-in-women-work-and-the-will-to-lead_183/index.html,25.02,In stock
818,"Lamb: The Gospel According to Biff, Christ's Childhood Pal",lamb-the-gospel-according-to-biff-christs-childhood-pal_182/index.html,55.50,In stock
819,Lady Renegades (Rebel Belle #3),lady-renegades-rebel-belle-3_181/index.html,53.04,In stock
820,Jurassic Park (Jurassic Park #1),jurassic-park-jurassic-park-1_180/index.html,44.97,In stock
821,It's Never Too Late to Begin Again: Discovering Creativity and Meaning at Midlife and Beyond,its-never-too-late-to-begin-again-discovering-creativity-and-meaning-at-midlife-and-beyond_179/index.html,42.38,In stock
822,Is Everyone Hanging Out Without Me? (And Other Concerns),is-everyone-hanging-out-without-me-and-other-concerns_178/index.html,20.11,In stock
823,Into the Wild,into-the-wild_177/index.html,56.70,In stock
824,Inferno (Robert Langdon #4),inferno-robert-langdon-4_176/index.html,41.00,In stock
825,"In the Garden of Beasts: Love, Terror, and an American Family in Hitler's Berlin",in-the-garden-of-beasts-love-terror-and-an-american-family-in-hitlers-berlin_175/index.html,28.85,In stock
826,If I Run (If I Run #1),if-i-run-if-i-run-1_174/index.html,49.97,In stock
827,I've Got Your Number,ive-got-your-number_173/index.html,19.69,In stock
828,I Am Malala: The Girl Who Stood Up for Education and Was Shot by the Taliban,i-am-malala-the-girl-who-stood-up-for-education-and-was-shot-by-the-taliban_172/index.html,28.88,In stock
829,Hungry Girl Clean & Hungry: Easy All-Natural Recipes for Healthy Eating in the Real World,hungry-girl-clean-hungry-easy-all-natural-recipes-for-healthy-eating-in-the-real-world_171/index.html,33.14,In stock
830,"House of Lost Worlds: Dinosaurs, Dynasties, and the Story of Life on Earth",house-of-lost-worlds-dinosaurs-dynasties-and-the-story-of-life-on-earth_170/index.html,43.70,In stock
831,House of Leaves,house-of-leaves_169/index.html,54.89,In stock
832,Horrible Bear!,horrible-bear_168/index.html,37.52,In stock
833,Holidays on Ice,holidays-on-ice_167/index.html,51.07,In stock
834,Heir to the Sky,heir-to-the-sky_166/index.html,44.07,In stock
835,Green Eggs and Ham (Beginner Books B-16),green-eggs-and-ham-beginner-books-b-16_165/index.html,10.79,In stock
836,"Grayson, Vol 3: Nemesis (Grayson #3)",grayson-vol-3-nemesis-grayson-3_164/index.html,42.72,In stock
837,Gratitude,gratitude_163/index.html,26.66,In stock
838,Gone Girl,gone-girl_162/index.html,37.60,In stock
839,Golden (Heart of Dread #3),golden-heart-of-dread-3_161/index.html,42.21,In stock
840,Girl in the Blue Coat,girl-in-the-blue-coat_160/index.html,46.83,In stock
841,"Fruits Basket, Vol. 3 (Fruits Basket #3)",fruits-basket-vol-3-fruits-basket-3_159/index.html,45.17,In stock
842,"Friday Night Lights: A Town, a Team, and a Dream",friday-night-lights-a-town-a-team-and-a-dream_158/index.html,51.22,In stock
843,Fire Bound (Sea Haven/Sisters of the Heart #5),fire-bound-sea-havensisters-of-the-heart-5_157/index.html,21.28,In stock
844,Fifty Shades Freed (Fifty Shades #3),fifty-shades-freed-fifty-shades-3_156/index.html,15.36,In stock
845,Fellside,fellside_155/index.html,38.62,In stock
846,Extreme Prey (Lucas Davenport #26),extreme-prey-lucas-davenport-26_154/index.html,25.40,In stock
847,Eragon (The Inheritance Cycle #1),eragon-the-inheritance-cycle-1_153/index.html,43.87,In stock
848,Eclipse (Twilight #3),eclipse-twilight-3_152/index.html,18.74,In stock
849,Dune (Dune #1),dune-dune-1_151/index.html,54.86,In stock
850,Dracula,dracula_150/index.html,52.62,In stock
851,Do Androids Dream of Electric Sheep? (Blade Runner #1),do-androids-dream-of-electric-sheep-blade-runner-1_149/index.html,51.48,In stock
852,Disrupted: My Misadventure in the Start-Up Bubble,disrupted-my-misadventure-in-the-start-up-bubble_148/index.html,15.28,In stock
853,Dead Wake: The Last Crossing of the Lusitania,dead-wake-the-last-crossing-of-the-lusitania_147/index.html,39.24,In stock
854,"David and Goliath: Underdogs, Misfits, and the Art of Battling Giants",david-and-goliath-underdogs-misfits-and-the-art-of-battling-giants_146/index.html,17.81,In stock
855,Darkfever (Fever #1),darkfever-fever-1_145/index.html,56.02,In stock
856,Dark Places,dark-places_144/index.html,23.90,In stock
857,Crazy Rich Asians (Crazy Rich Asians #1),crazy-rich-asians-crazy-rich-asians-1_143/index.html,49.13,In stock
858,Counting Thyme,counting-thyme_142/index.html,10.62,In stock
859,Cosmos,cosmos_141/index.html,36.17,In stock
860,Civilization and Its Discontents,civilization-and-its-discontents_140/index.html,59.95,In stock
861,Cinder (The Lunar Chronicles #1),cinder-the-lunar-chronicles-1_139/index.html,26.09,In stock
862,Catastrophic Happiness: Finding Joy in Childhood's Messy Years,catastrophic-happiness-finding-joy-in-childhoods-messy-years_138/index.html,37.35,In stock
863,Career of Evil (Cormoran Strike #3),career-of-evil-cormoran-strike-3_137/index.html,24.72,In stock
864,Breaking Dawn (Twilight #4),breaking-dawn-twilight-4_136/index.html,35.28,In stock
865,Brave Enough,brave-enough_135/index.html,51.32,In stock
866,Boy Meets Boy,boy-meets-boy_134/index.html,21.12,In stock
867,"Born to Run: A Hidden Tribe, Superathletes, and the Greatest Race the World Has Never Seen",born-to-run-a-hidden-tribe-superathletes-and-the-greatest-race-the-world-has-never-seen_133/index.html,27.35,In stock
868,Blink: The Power of Thinking Without Thinking,blink-the-power-of-thinking-without-thinking_132/index.html,21.74,In stock
869,Black Flags: The Rise of ISIS,black-flags-the-rise-of-isis_131/index.html,40.87,In stock
870,"Black Butler, Vol. 1 (Black Butler #1)",black-butler-vol-1-black-butler-1_130/index.html,49.31,In stock
871,Big Little Lies,big-little-lies_129/index.html,22.11,In stock
872,Between Shades of Gray,between-shades-of-gray_128/index.html,20.79,In stock
873,Best of My Love (Fool's Gold #20),best-of-my-love-fools-gold-20_127/index.html,27.41,In stock
874,Beowulf,beowulf_126/index.html,38.35,In stock
875,Beautiful Creatures (Caster Chronicles #1),beautiful-creatures-caster-chronicles-1_125/index.html,21.55,In stock
876,Awkward,awkward_124/index.html,38.02,In stock
877,Ash,ash_123/index.html,22.06,In stock
878,Are We There Yet?,are-we-there-yet_122/index.html,10.66,In stock
879,Are We Smart Enough to Know How Smart Animals Are?,are-we-smart-enough-to-know-how-smart-animals-are_121/index.html,56.58,In stock
880,Annie on My Mind,annie-on-my-mind_120/index.html,36.83,In stock
881,And Then There Were None,and-then-there-were-none_119/index.html,35.01,In stock
882,A Walk in the Woods: Rediscovering America on the Appalachian Trail,a-walk-in-the-woods-rediscovering-america-on-the-appalachian-trail_118/index.html,30.48,In stock
883,A Visit from the Goon Squad,a-visit-from-the-goon-squad_117/index.html,14.08,In stock
884,A Storm of Swords (A Song of Ice and Fire #3),a-storm-of-swords-a-song-of-ice-and-fire-3_116/index.html,31.22,In stock
885,A Heartbreaking Work of Staggering Genius,a-heartbreaking-work-of-staggering-genius_115/index.html,54.29,In stock
886,8 Keys to Mental Health Through Exercise,8-keys-to-mental-health-through-exercise_114/index.html,31.04,In stock
887,#GIRLBOSS,girlboss_113/index.html,50.96,In stock
888,"The Suffragettes (Little Black Classics, #96)",the-suffragettes-little-black-classics-96_112/index.html,11.89,In stock
889,The Sense of an Ending,the-sense-of-an-ending_111/index.html,31.38,In stock
890,"The Sandman, Vol. 2: The Doll's House (The Sandman (volumes) #2)",the-sandman-vol-2-the-dolls-house-the-sandman-volumes-2_110/index.html,54.81,In stock
891,The Course of Love,the-course-of-love_109/index.html,16.78,In stock
892,Sugar Rush (Offensive Line #2),sugar-rush-offensive-line-2_108/index.html,24.42,In stock
893,"Saga, Volume 2 (Saga (Collected Editions) #2)",saga-volume-2-saga-collected-editions-2_107/index.html,11.75,In stock
894,"Run, Spot, Run: The Ethics of Keeping Pets",run-spot-run-the-ethics-of-keeping-pets_106/index.html,20.02,In stock
895,New Moon (Twilight #2),new-moon-twilight-2_105/index.html,12.86,In stock
896,Life,life_104/index.html,31.58,In stock
897,Kindle Paperwhite User's Guide,kindle-paperwhite-users-guide_103/index.html,34.00,In stock
898,H is for Hawk,h-is-for-hawk_102/index.html,57.42,In stock
899,Girl Online On Tour (Girl Online #2),girl-online-on-tour-girl-online-2_101/index.html,53.47,In stock
