,Title,Link,Price,Stock
438,Dress Your Family in Corduroy and Denim,dress-your-family-in-corduroy-and-denim_562/index.html,43.68,In stock
439,Don't Forget Steven,dont-forget-steven_561/index.html,33.23,In stock
440,Chernobyl 01:23:40: The Incredible True Story of the World's Worst Nuclear Disaster,chernobyl-012340-the-incredible-true-story-of-the-worlds-worst-nuclear-disaster_560/index.html,35.92,In stock
441,Art and Fear: Observations on the Perils (and Rewards) of Artmaking,art-and-fear-observations-on-the-perils-and-rewards-of-artmaking_559/index.html,48.63,In stock
442,A Shard of Ice (The Black Symphony Saga #1),a-shard-of-ice-the-black-symphony-saga-1_558/index.html,56.63,In stock
443,A Hero's Curse (The Unseen Chronicles #1),a-heros-curse-the-unseen-chronicles-1_557/index.html,50.49,In stock
444,23 Degrees South: A Tropical Tale of Changing Whether...,23-degrees-south-a-tropical-tale-of-changing-whether_556/index.html,35.79,In stock
445,"Zero to One: Notes on Startups, or How to Build the Future",zero-to-one-notes-on-startups-or-how-to-build-the-future_555/index.html,34.06,In stock
446,Why Not Me?,why-not-me_554/index.html,17.76,In stock
447,When Breath Becomes Air,when-breath-becomes-air_553/index.html,39.36,In stock
448,Vagabonding: An Uncommon Guide to the Art of Long-Term World Travel,vagabonding-an-uncommon-guide-to-the-art-of-long-term-world-travel_552/index.html,36.94,In stock
449,The Unlikely Pilgrimage of Harold Fry (Harold Fry #1),the-unlikely-pilgrimage-of-harold-fry-harold-fry-1_551/index.html,43.62,In stock
450,The New Drawing on the Right Side of the Brain,the-new-drawing-on-the-right-side-of-the-brain_550/index.html,43.02,In stock
451,"The Midnight Assassin: Panic, Scandal, and the Hunt for America's First Serial Killer",the-midnight-assassin-panic-scandal-and-the-hunt-for-americas-first-serial-killer_549/index.html,28.45,In stock
452,The Martian (The Martian #1),the-martian-the-martian-1_548/index.html,41.39,In stock
453,The High Mountains of Portugal,the-high-mountains-of-portugal_547/index.html,51.15,In stock
454,The Grownup,the-grownup_546/index.html,35.88,In stock
455,The E-Myth Revisited: Why Most Small Businesses Don't Work and What to Do About It,the-e-myth-revisited-why-most-small-businesses-dont-work-and-what-to-do-about-it_545/index.html,36.91,In stock
456,South of Sunshine,south-of-sunshine_544/index.html,28.93,In stock
457,Smarter Faster Better: The Secrets of Being Productive in Life and Business,smarter-faster-better-the-secrets-of-being-productive-in-life-and-business_543/index.html,38.89,In stock
458,Silence in the Dark (Logan Point #4),silence-in-the-dark-logan-point-4_542/index.html,58.33,In stock
459,Shadows of the Past (Logan Point #1),shadows-of-the-past-logan-point-1_541/index.html,39.67,In stock
460,Roller Girl,roller-girl_540/index.html,14.10,In stock
461,Rising Strong,rising-strong_539/index.html,21.82,In stock
462,Proofs of God: Classical Arguments from Tertullian to Barth,proofs-of-god-classical-arguments-from-tertullian-to-barth_538/index.html,54.21,In stock
463,Please Kill Me: The Uncensored Oral History of Punk,please-kill-me-the-uncensored-oral-history-of-punk_537/index.html,31.19,In stock
464,Out of Print: City Lights Spotlight No. 14,out-of-print-city-lights-spotlight-no-14_536/index.html,53.64,In stock
465,My Life Next Door (My Life Next Door ),my-life-next-door-my-life-next-door_535/index.html,36.39,In stock
466,Miller's Valley,millers-valley_534/index.html,58.54,In stock
467,Man's Search for Meaning,mans-search-for-meaning_533/index.html,29.48,In stock
468,"Love That Boy: What Two Presidents, Eight Road Trips, and My Son Taught Me About a Parent's Expectations",love-that-boy-what-two-presidents-eight-road-trips-and-my-son-taught-me-about-a-parents-expectations_532/index.html,25.06,In stock
469,Living Forward: A Proven Plan to Stop Drifting and Get the Life You Want,living-forward-a-proven-plan-to-stop-drifting-and-get-the-life-you-want_531/index.html,12.55,In stock
470,Les Fleurs du Mal,les-fleurs-du-mal_530/index.html,29.04,In stock
471,Left Behind (Left Behind #1),left-behind-left-behind-1_529/index.html,40.72,In stock
472,Kill 'Em and Leave: Searching for James Brown and the American Soul,kill-em-and-leave-searching-for-james-brown-and-the-american-soul_528/index.html,45.05,In stock
473,Kierkegaard: A Christian Missionary to Christians,kierkegaard-a-christian-missionary-to-christians_527/index.html,47.13,In stock
474,John Vassos: Industrial Design for Modern Life,john-vassos-industrial-design-for-modern-life_526/index.html,20.22,In stock
475,I'll Give You the Sun,ill-give-you-the-sun_525/index.html,56.48,In stock
476,I Will Find You,i-will-find-you_524/index.html,44.21,In stock
477,Hystopia: A Novel,hystopia-a-novel_523/index.html,21.96,In stock
478,Howl and Other Poems,howl-and-other-poems_522/index.html,40.45,In stock
479,History of Beauty,history-of-beauty_521/index.html,10.29,In stock
480,Heaven is for Real: A Little Boy's Astounding Story of His Trip to Heaven and Back,heaven-is-for-real-a-little-boys-astounding-story-of-his-trip-to-heaven-and-back_520/index.html,52.86,In stock
481,Future Shock (Future Shock #1),future-shock-future-shock-1_519/index.html,55.65,In stock
482,Ender's Game (The Ender Quintet #1),enders-game-the-ender-quintet-1_518/index.html,43.64,In stock
483,Diary of a Citizen Scientist: Chasing Tiger Beetles and Other New Ways of Engaging the World,diary-of-a-citizen-scientist-chasing-tiger-beetles-and-other-new-ways-of-engaging-the-world_517/index.html,28.41,In stock
484,Death by Leisure: A Cautionary Tale,death-by-leisure-a-cautionary-tale_516/index.html,37.51,In stock
485,Brilliant Beacons: A History of the American Lighthouse,brilliant-beacons-a-history-of-the-american-lighthouse_515/index.html,11.45,In stock
486,Brazen: The Courage to Find the You That's Been Hiding,brazen-the-courage-to-find-the-you-thats-been-hiding_514/index.html,19.22,In stock
487,Between the World and Me,between-the-world-and-me_513/index.html,56.91,In stock
488,Being Mortal: Medicine and What Matters in the End,being-mortal-medicine-and-what-matters-in-the-end_512/index.html,55.06,In stock
489,"A Murder Over a Girl: Justice, Gender, Junior High",a-murder-over-a-girl-justice-gender-junior-high_511/index.html,13.20,In stock
490,32 Yolks,32-yolks_510/index.html,53.63,In stock
491,"""Most Blessed of the Patriarchs"": Thomas Jefferson and the Empire of the Imagination",most-blessed-of-the-patriarchs-thomas-jefferson-and-the-empire-of-the-imagination_509/index.html,44.48,In stock
492,You Are a Badass: How to Stop Doubting Your Greatness and Start Living an Awesome Life,you-are-a-badass-how-to-stop-doubting-your-greatness-and-start-living-an-awesome-life_508/index.html,12.08,In stock
493,Wildlife of New York: A Five-Borough Coloring Book,wildlife-of-new-york-a-five-borough-coloring-book_507/index.html,22.14,In stock
494,What Happened on Beale Street (Secrets of the South Mysteries #2),what-happened-on-beale-street-secrets-of-the-south-mysteries-2_506/index.html,25.37,In stock
495,Unreasonable Hope: Finding Faith in the God Who Brings Purpose to Your Pain,unreasonable-hope-finding-faith-in-the-god-who-brings-purpose-to-your-pain_505/index.html,46.33,In stock
496,Under the Tuscan Sun,under-the-tuscan-sun_504/index.html,37.33,In stock
497,Toddlers Are A**holes: It's Not Your Fault,toddlers-are-aholes-its-not-your-fault_503/index.html,25.55,In stock
498,The Year of Living Biblically: One Man's Humble Quest to Follow the Bible as Literally as Possible,the-year-of-living-biblically-one-mans-humble-quest-to-follow-the-bible-as-literally-as-possible_502/index.html,34.72,In stock
499,The Whale,the-whale_501/index.html,35.96,In stock
500,The Story of Art,the-story-of-art_500/index.html,41.14,In stock
501,The Origin of Species,the-origin-of-species_499/index.html,10.01,In stock
502,The Great Gatsby,the-great-gatsby_498/index.html,36.05,In stock
503,The Good Girl,the-good-girl_497/index.html,49.03,In stock
504,The Glass Castle,the-glass-castle_496/index.html,16.24,In stock
505,The Faith of Christopher Hitchens: The Restless Soul of the World's Most Notorious Atheist,the-faith-of-christopher-hitchens-the-restless-soul-of-the-worlds-most-notorious-atheist_495/index.html,39.55,In stock
506,The Drowning Girls,the-drowning-girls_494/index.html,35.67,In stock
507,The Constant Princess (The Tudor Court #1),the-constant-princess-the-tudor-court-1_493/index.html,16.62,In stock
508,The Bourne Identity (Jason Bourne #1),the-bourne-identity-jason-bourne-1_492/index.html,42.78,In stock
509,The Bachelor Girl's Guide to Murder (Herringford and Watts Mysteries #1),the-bachelor-girls-guide-to-murder-herringford-and-watts-mysteries-1_491/index.html,52.30,In stock
510,The Art Book,the-art-book_490/index.html,32.34,In stock
511,The 7 Habits of Highly Effective People: Powerful Lessons in Personal Change,the-7-habits-of-highly-effective-people-powerful-lessons-in-personal-change_489/index.html,33.17,In stock
512,Team of Rivals: The Political Genius of Abraham Lincoln,team-of-rivals-the-political-genius-of-abraham-lincoln_488/index.html,20.12,In stock
513,Steal Like an Artist: 10 Things Nobody Told You About Being Creative,steal-like-an-artist-10-things-nobody-told-you-about-being-creative_487/index.html,20.90,In stock
514,"Sit, Stay, Love",sit-stay-love_486/index.html,20.90,In stock
515,Sister Dear,sister-dear_485/index.html,40.20,In stock
516,"Shrunken Treasures: Literary Classics, Short, Sweet, and Silly",shrunken-treasures-literary-classics-short-sweet-and-silly_484/index.html,52.87,In stock
517,"Rich Dad, Poor Dad",rich-dad-poor-dad_483/index.html,51.74,In stock
518,Raymie Nightingale,raymie-nightingale_482/index.html,34.41,In stock
519,Playing from the Heart,playing-from-the-heart_481/index.html,32.38,In stock
520,Nightstruck: A Novel,nightstruck-a-novel_480/index.html,50.35,In stock
521,"Naturally Lean: 125 Nourishing Gluten-Free, Plant-Based Recipes--All Under 300 Calories",naturally-lean-125-nourishing-gluten-free-plant-based-recipes-all-under-300-calories_479/index.html,11.38,In stock
522,Meternity,meternity_478/index.html,43.58,In stock
523,Memoirs of a Geisha,memoirs-of-a-geisha_477/index.html,49.67,In stock
524,Like Never Before (Walker Family #2),like-never-before-walker-family-2_476/index.html,28.77,In stock
525,Life of Pi,life-of-pi_475/index.html,13.22,In stock
526,Leave This Song Behind: Teen Poetry at Its Best,leave-this-song-behind-teen-poetry-at-its-best_474/index.html,51.17,In stock
527,King's Folly (The Kinsman Chronicles #1),kings-folly-the-kinsman-chronicles-1_473/index.html,39.61,In stock
528,John Adams,john-adams_472/index.html,57.43,In stock
529,How to Cook Everything Vegetarian: Simple Meatless Recipes for Great Food (How to Cook Everything),how-to-cook-everything-vegetarian-simple-meatless-recipes-for-great-food-how-to-cook-everything_471/index.html,46.01,In stock
530,How to Be a Domestic Goddess: Baking and the Art of Comfort Cooking,how-to-be-a-domestic-goddess-baking-and-the-art-of-comfort-cooking_470/index.html,28.25,In stock
531,Good in Bed (Cannie Shapiro #1),good-in-bed-cannie-shapiro-1_469/index.html,37.05,In stock
532,"Fruits Basket, Vol. 7 (Fruits Basket #7)",fruits-basket-vol-7-fruits-basket-7_468/index.html,19.57,In stock
533,For the Love: Fighting for Grace in a World of Impossible Standards,for-the-love-fighting-for-grace-in-a-world-of-impossible-standards_467/index.html,45.13,In stock
534,Finding God in the Ruins: How God Redeems Pain,finding-god-in-the-ruins-how-god-redeems-pain_466/index.html,46.64,In stock
535,Every Heart a Doorway (Every Heart A Doorway #1),every-heart-a-doorway-every-heart-a-doorway-1_465/index.html,12.16,In stock
536,Delivering the Truth (Quaker Midwife Mystery #1),delivering-the-truth-quaker-midwife-mystery-1_464/index.html,20.89,In stock
537,Counted With the Stars (Out from Egypt #1),counted-with-the-stars-out-from-egypt-1_463/index.html,17.97,In stock
538,"Chronicles, Vol. 1",chronicles-vol-1_462/index.html,52.60,In stock
539,Blue Like Jazz: Nonreligious Thoughts on Christian Spirituality,blue-like-jazz-nonreligious-thoughts-on-christian-spirituality_461/index.html,25.77,In stock
540,Benjamin Franklin: An American Life,benjamin-franklin-an-american-life_460/index.html,48.19,In stock
541,"At The Existentialist Café: Freedom, Being, and apricot cocktails with: Jean-Paul Sartre, Simone de Beauvoir, Albert Camus, Martin Heidegger, Edmund Husserl, Karl Jaspers, Maurice Merleau-Ponty and others",at-the-existentialist-cafe-freedom-being-and-apricot-cocktails-with-jean-paul-sartre-simone-de-beauvoir-albert-camus-martin-heidegger-edmund-husserl-karl-jaspers-maurice-merleau-ponty-and-others_459/index.html,29.93,In stock
542,A Summer In Europe,a-summer-in-europe_458/index.html,44.34,In stock
543,A Short History of Nearly Everything,a-short-history-of-nearly-everything_457/index.html,52.40,In stock
544,A Gathering of Shadows (Shades of Magic #2),a-gathering-of-shadows-shades-of-magic-2_456/index.html,44.81,In stock
545,The Sound Of Love,the-sound-of-love_455/index.html,57.84,In stock
546,The Rise and Fall of the Third Reich: A History of Nazi Germany,the-rise-and-fall-of-the-third-reich-a-history-of-nazi-germany_454/index.html,39.67,In stock
547,The Perks of Being a Wallflower,the-perks-of-being-a-wallflower_453/index.html,55.02,In stock
548,The Mysterious Affair at Styles (Hercule Poirot #1),the-mysterious-affair-at-styles-hercule-poirot-1_452/index.html,24.80,In stock
549,The Man Who Mistook His Wife for a Hat and Other Clinical Tales,the-man-who-mistook-his-wife-for-a-hat-and-other-clinical-tales_451/index.html,59.45,In stock
550,The Makings of a Fatherless Child,the-makings-of-a-fatherless-child_450/index.html,31.58,In stock
551,The Joy of Cooking,the-joy-of-cooking_449/index.html,43.27,In stock
552,The Invention of Wings,the-invention-of-wings_448/index.html,37.34,In stock
553,The Hobbit (Middle-Earth Universe),the-hobbit-middle-earth-universe_447/index.html,17.80,In stock
554,The Great Railway Bazaar,the-great-railway-bazaar_446/index.html,30.54,In stock
555,The Golden Compass (His Dark Materials #1),the-golden-compass-his-dark-materials-1_445/index.html,18.77,In stock
556,The God Delusion,the-god-delusion_444/index.html,46.85,In stock
557,The Girl You Left Behind (The Girl You Left Behind #1),the-girl-you-left-behind-the-girl-you-left-behind-1_443/index.html,15.79,In stock
558,The Fellowship of the Ring (The Lord of the Rings #1),the-fellowship-of-the-ring-the-lord-of-the-rings-1_442/index.html,10.27,In stock
559,The Collected Poems of W.B. Yeats (The Collected Works of W.B. Yeats #1),the-collected-poems-of-wb-yeats-the-collected-works-of-wb-yeats-1_441/index.html,15.42,In stock
560,The Barefoot Contessa Cookbook,the-barefoot-contessa-cookbook_440/index.html,59.92,In stock
561,Tell the Wolves I'm Home,tell-the-wolves-im-home_439/index.html,50.96,In stock
562,Ship Leaves Harbor: Essays on Travel by a Recovering Journeyman,ship-leaves-harbor-essays-on-travel-by-a-recovering-journeyman_438/index.html,30.60,In stock
563,Pride and Prejudice,pride-and-prejudice_437/index.html,19.27,In stock
564,Musicophilia: Tales of Music and the Brain,musicophilia-tales-of-music-and-the-brain_436/index.html,46.58,In stock
565,Mere Christianity,mere-christianity_435/index.html,48.51,In stock
566,Me Before You (Me Before You #1),me-before-you-me-before-you-1_434/index.html,19.02,In stock
567,In the Woods (Dublin Murder Squad #1),in-the-woods-dublin-murder-squad-1_433/index.html,38.38,In stock
568,In Cold Blood,in-cold-blood_432/index.html,49.98,In stock
569,How to Stop Worrying and Start Living,how-to-stop-worrying-and-start-living_431/index.html,46.49,In stock
570,Give It Back,give-it-back_430/index.html,18.32,In stock
571,"Girl, Interrupted",girl-interrupted_429/index.html,42.14,In stock
572,Fun Home: A Family Tragicomic,fun-home-a-family-tragicomic_428/index.html,56.59,In stock
573,"Fruits Basket, Vol. 6 (Fruits Basket #6)",fruits-basket-vol-6-fruits-basket-6_427/index.html,20.96,In stock
574,Deception Point,deception-point_426/index.html,40.32,In stock
575,"Death Note, Vol. 6: Give-and-Take (Death Note #6)",death-note-vol-6-give-and-take-death-note-6_425/index.html,36.39,In stock
576,Catherine the Great: Portrait of a Woman,catherine-the-great-portrait-of-a-woman_424/index.html,58.55,In stock
577,Better Homes and Gardens New Cook Book,better-homes-and-gardens-new-cook-book_423/index.html,39.61,In stock
578,An Unquiet Mind: A Memoir of Moods and Madness,an-unquiet-mind-a-memoir-of-moods-and-madness_422/index.html,21.30,In stock
579,A Year in Provence (Provence #1),a-year-in-provence-provence-1_421/index.html,56.88,In stock
580,World Without End (The Pillars of the Earth #2),world-without-end-the-pillars-of-the-earth-2_420/index.html,32.97,In stock
581,"Will Grayson, Will Grayson (Will Grayson, Will Grayson)",will-grayson-will-grayson-will-grayson-will-grayson_419/index.html,47.31,In stock
582,Why Save the Bankers?: And Other Essays on Our Economic and Political Crisis,why-save-the-bankers-and-other-essays-on-our-economic-and-political-crisis_418/index.html,48.67,In stock
583,Where She Went (If I Stay #2),where-she-went-if-i-stay-2_417/index.html,41.73,In stock
584,What If?: Serious Scientific Answers to Absurd Hypothetical Questions,what-if-serious-scientific-answers-to-absurd-hypothetical-questions_416/index.html,53.68,In stock
585,Two Summers,two-summers_415/index.html,14.64,In stock
586,This Is Your Brain on Music: The Science of a Human Obsession,this-is-your-brain-on-music-the-science-of-a-human-obsession_414/index.html,38.40,In stock
587,The Secret Garden,the-secret-garden_413/index.html,15.08,In stock
588,The Raven King (The Raven Cycle #4),the-raven-king-the-raven-cycle-4_412/index.html,30.57,In stock
589,The Raven Boys (The Raven Cycle #1),the-raven-boys-the-raven-cycle-1_411/index.html,57.74,In stock
590,The Power Greens Cookbook: 140 Delicious Superfood Recipes,the-power-greens-cookbook-140-delicious-superfood-recipes_410/index.html,11.05,In stock
591,The Metamorphosis,the-metamorphosis_409/index.html,28.58,In stock
592,The Mathews Men: Seven Brothers and the War Against Hitler's U-boats,the-mathews-men-seven-brothers-and-the-war-against-hitlers-u-boats_408/index.html,42.91,In stock
593,The Little Paris Bookshop,the-little-paris-bookshop_407/index.html,24.73,In stock
594,The Hiding Place,the-hiding-place_406/index.html,55.91,In stock
595,The Grand Design,the-grand-design_405/index.html,13.76,In stock
596,The Firm,the-firm_404/index.html,45.56,In stock
597,The Fault in Our Stars,the-fault-in-our-stars_403/index.html,47.22,In stock
598,The False Prince (The Ascendance Trilogy #1),the-false-prince-the-ascendance-trilogy-1_402/index.html,56.00,In stock
599,The Expatriates,the-expatriates_401/index.html,44.58,In stock
600,The Dream Thieves (The Raven Cycle #2),the-dream-thieves-the-raven-cycle-2_400/index.html,34.50,In stock
601,The Darkest Corners,the-darkest-corners_399/index.html,11.33,In stock
602,The Crossover,the-crossover_398/index.html,38.77,In stock
603,The 5th Wave (The 5th Wave #1),the-5th-wave-the-5th-wave-1_397/index.html,11.83,In stock
604,Tell the Wind and Fire,tell-the-wind-and-fire_396/index.html,45.51,In stock
605,Tell Me Three Things,tell-me-three-things_395/index.html,41.81,In stock
606,Talking to Girls About Duran Duran: One Young Man's Quest for True Love and a Cooler Haircut,talking-to-girls-about-duran-duran-one-young-mans-quest-for-true-love-and-a-cooler-haircut_394/index.html,25.15,In stock
607,Siddhartha,siddhartha_393/index.html,34.22,In stock
608,Shiver (The Wolves of Mercy Falls #1),shiver-the-wolves-of-mercy-falls-1_392/index.html,16.23,In stock
609,Remember Me?,remember-me_391/index.html,11.48,In stock
610,Red Dragon (Hannibal Lecter #1),red-dragon-hannibal-lecter-1_390/index.html,23.37,In stock
611,Peak: Secrets from the New Science of Expertise,peak-secrets-from-the-new-science-of-expertise_389/index.html,16.28,In stock
612,My Mother Was Nuts,my-mother-was-nuts_388/index.html,31.63,In stock
613,Mexican Today: New and Rediscovered Recipes for Contemporary Kitchens,mexican-today-new-and-rediscovered-recipes-for-contemporary-kitchens_387/index.html,24.91,In stock
614,Maybe Something Beautiful: How Art Transformed a Neighborhood,maybe-something-beautiful-how-art-transformed-a-neighborhood_386/index.html,22.54,In stock
615,Lola and the Boy Next Door (Anna and the French Kiss #2),lola-and-the-boy-next-door-anna-and-the-french-kiss-2_385/index.html,23.63,In stock
616,Logan Kade (Fallen Crest High #5.5),logan-kade-fallen-crest-high-55_384/index.html,13.12,In stock
617,Last One Home (New Beginnings #1),last-one-home-new-beginnings-1_383/index.html,59.98,In stock
618,Killing Floor (Jack Reacher #1),killing-floor-jack-reacher-1_382/index.html,31.49,In stock
619,Kill the Boy Band,kill-the-boy-band_381/index.html,15.52,In stock
620,Isla and the Happily Ever After (Anna and the French Kiss #3),isla-and-the-happily-ever-after-anna-and-the-french-kiss-3_380/index.html,48.13,In stock
621,If I Stay (If I Stay #1),if-i-stay-if-i-stay-1_379/index.html,38.13,In stock
622,I Know Why the Caged Bird Sings (Maya Angelou's Autobiography #1),i-know-why-the-caged-bird-sings-maya-angelous-autobiography-1_378/index.html,36.55,In stock
623,Harry Potter and the Deathly Hallows (Harry Potter #7),harry-potter-and-the-deathly-hallows-harry-potter-7_377/index.html,23.32,In stock
624,"Fruits Basket, Vol. 5 (Fruits Basket #5)",fruits-basket-vol-5-fruits-basket-5_376/index.html,16.33,In stock
625,Foundation (Foundation (Publication Order) #1),foundation-foundation-publication-order-1_375/index.html,32.42,In stock
626,Fool Me Once,fool-me-once_374/index.html,16.96,In stock
627,Find Her (Detective D.D. Warren #8),find-her-detective-dd-warren-8_373/index.html,22.37,In stock
628,Evicted: Poverty and Profit in the American City,evicted-poverty-and-profit-in-the-american-city_372/index.html,42.27,In stock
629,Drama,drama_371/index.html,38.70,In stock
630,Dracula the Un-Dead,dracula-the-un-dead_370/index.html,35.63,In stock
631,Digital Fortress,digital-fortress_369/index.html,58.00,In stock
632,"Death Note, Vol. 5: Whiteout (Death Note #5)",death-note-vol-5-whiteout-death-note-5_368/index.html,52.41,In stock
633,"Data, A Love Story: How I Gamed Online Dating to Meet My Match",data-a-love-story-how-i-gamed-online-dating-to-meet-my-match_367/index.html,32.35,In stock
634,Critique of Pure Reason,critique-of-pure-reason_366/index.html,20.75,In stock
635,Booked,booked_365/index.html,17.49,In stock
636,"Blue Lily, Lily Blue (The Raven Cycle #3)",blue-lily-lily-blue-the-raven-cycle-3_364/index.html,34.13,In stock
637,Approval Junkie: Adventures in Caring Too Much,approval-junkie-adventures-in-caring-too-much_363/index.html,58.81,In stock
638,An Abundance of Katherines,an-abundance-of-katherines_362/index.html,10.00,In stock
639,America's War for the Greater Middle East: A Military History,americas-war-for-the-greater-middle-east-a-military-history_361/index.html,51.22,In stock
640,Alight (The Generations Trilogy #2),alight-the-generations-trilogy-2_360/index.html,58.59,In stock
641,A Girl's Guide to Moving On (New Beginnings #2),a-girls-guide-to-moving-on-new-beginnings-2_359/index.html,31.30,In stock
642,A Game of Thrones (A Song of Ice and Fire #1),a-game-of-thrones-a-song-of-ice-and-fire-1_358/index.html,46.42,In stock
643,A Feast for Crows (A Song of Ice and Fire #4),a-feast-for-crows-a-song-of-ice-and-fire-4_357/index.html,17.21,In stock
644,A Clash of Kings (A Song of Ice and Fire #2),a-clash-of-kings-a-song-of-ice-and-fire-2_356/index.html,10.79,In stock
645,Vogue Colors A to Z: A Fashion Coloring Book,vogue-colors-a-to-z-a-fashion-coloring-book_355/index.html,52.35,In stock
646,The Shining (The Shining #1),the-shining-the-shining-1_354/index.html,27.88,In stock
647,The Pilgrim's Progress,the-pilgrims-progress_353/index.html,50.26,In stock
648,The Perfect Play (Play by Play #1),the-perfect-play-play-by-play-1_352/index.html,59.99,In stock
649,The Passion of Dolssa,the-passion-of-dolssa_351/index.html,28.32,In stock
650,The Jazz of Physics: The Secret Link Between Music and the Structure of the Universe,the-jazz-of-physics-the-secret-link-between-music-and-the-structure-of-the-universe_350/index.html,38.71,In stock
651,The Hunger Games (The Hunger Games #1),the-hunger-games-the-hunger-games-1_349/index.html,29.85,In stock
652,The Hound of the Baskervilles (Sherlock Holmes #5),the-hound-of-the-baskervilles-sherlock-holmes-5_348/index.html,14.82,In stock
653,The Gunning of America: Business and the Making of American Gun Culture,the-gunning-of-america-business-and-the-making-of-american-gun-culture_347/index.html,16.81,In stock
654,The Geography of Bliss: One Grump's Search for the Happiest Places in the World,the-geography-of-bliss-one-grumps-search-for-the-happiest-places-in-the-world_346/index.html,28.23,In stock
655,The Demonists (Demonist #1),the-demonists-demonist-1_345/index.html,52.11,In stock
656,"The Demon Prince of Momochi House, Vol. 4 (The Demon Prince of Momochi House #4)",the-demon-prince-of-momochi-house-vol-4-the-demon-prince-of-momochi-house-4_344/index.html,27.88,In stock
657,The Bone Hunters (Lexy Vaughan & Steven Macaulay #2),the-bone-hunters-lexy-vaughan-steven-macaulay-2_343/index.html,59.71,In stock
658,The Beast (Black Dagger Brotherhood #14),the-beast-black-dagger-brotherhood-14_342/index.html,46.08,In stock
659,Some Women,some-women_341/index.html,13.73,In stock
660,Shopaholic Ties the Knot (Shopaholic #3),shopaholic-ties-the-knot-shopaholic-3_340/index.html,48.39,In stock
661,Paper and Fire (The Great Library #2),paper-and-fire-the-great-library-2_339/index.html,49.45,In stock
