,Title,Link,Price,Stock
209,Ayumi's Violin,ayumis-violin_791/index.html,15.48,In stock
210,Anonymous,anonymous_790/index.html,46.82,In stock
211,Amy Meets the Saints and Sages,amy-meets-the-saints-and-sages_789/index.html,18.46,In stock
212,Amid the Chaos,amid-the-chaos_788/index.html,36.58,In stock
213,Amatus,amatus_787/index.html,50.54,In stock
214,Agnostic: A Spirited Manifesto,agnostic-a-spirited-manifesto_786/index.html,12.51,In stock
215,Zealot: The Life and Times of Jesus of Nazareth,zealot-the-life-and-times-of-jesus-of-nazareth_785/index.html,24.70,In stock
216,You (You #1),you-you-1_784/index.html,43.61,In stock
217,"Wonder Woman: Earth One, Volume One (Wonder Woman: Earth One #1)",wonder-woman-earth-one-volume-one-wonder-woman-earth-one-1_783/index.html,37.34,In stock
218,Wild Swans,wild-swans_782/index.html,14.36,In stock
219,Why the Right Went Wrong: Conservatism--From Goldwater to the Tea Party and Beyond,why-the-right-went-wrong-conservatism-from-goldwater-to-the-tea-party-and-beyond_781/index.html,52.65,In stock
220,Whole Lotta Creativity Going On: 60 Fun and Unusual Exercises to Awaken and Strengthen Your Creativity,whole-lotta-creativity-going-on-60-fun-and-unusual-exercises-to-awaken-and-strengthen-your-creativity_780/index.html,38.20,In stock
221,What's It Like in Space?: Stories from Astronauts Who've Been There,whats-it-like-in-space-stories-from-astronauts-whove-been-there_779/index.html,19.60,In stock
222,"We Are Robin, Vol. 1: The Vigilante Business (We Are Robin #1)",we-are-robin-vol-1-the-vigilante-business-we-are-robin-1_778/index.html,53.90,In stock
223,Walt Disney's Alice in Wonderland,walt-disneys-alice-in-wonderland_777/index.html,12.96,In stock
224,V for Vendetta (V for Vendetta Complete),v-for-vendetta-v-for-vendetta-complete_776/index.html,37.10,In stock
225,Until Friday Night (The Field Party #1),until-friday-night-the-field-party-1_775/index.html,46.31,In stock
226,"Unbroken: A World War II Story of Survival, Resilience, and Redemption",unbroken-a-world-war-ii-story-of-survival-resilience-and-redemption_774/index.html,45.95,In stock
227,Twenty Yawns,twenty-yawns_773/index.html,22.08,In stock
228,Through the Woods,through-the-woods_772/index.html,25.38,In stock
229,This Is Where It Ends,this-is-where-it-ends_771/index.html,27.12,In stock
230,The Year of Magical Thinking,the-year-of-magical-thinking_770/index.html,43.04,In stock
231,The Wright Brothers,the-wright-brothers_769/index.html,56.80,In stock
232,The White Queen (The Cousins' War #1),the-white-queen-the-cousins-war-1_768/index.html,25.91,In stock
233,The Wedding Pact (The O'Malleys #2),the-wedding-pact-the-omalleys-2_767/index.html,32.61,In stock
234,The Time Keeper,the-time-keeper_766/index.html,27.88,In stock
235,The Testament of Mary,the-testament-of-mary_765/index.html,52.67,In stock
236,The Star-Touched Queen,the-star-touched-queen_764/index.html,46.02,In stock
237,The Songs of the Gods,the-songs-of-the-gods_763/index.html,44.48,In stock
238,The Song of Achilles,the-song-of-achilles_762/index.html,37.40,In stock
239,The Rosie Project (Don Tillman #1),the-rosie-project-don-tillman-1_761/index.html,54.04,In stock
240,The Power of Habit: Why We Do What We Do in Life and Business,the-power-of-habit-why-we-do-what-we-do-in-life-and-business_760/index.html,16.88,In stock
241,The Marriage of Opposites,the-marriage-of-opposites_759/index.html,28.08,In stock
242,The Lucifer Effect: Understanding How Good People Turn Evil,the-lucifer-effect-understanding-how-good-people-turn-evil_758/index.html,10.40,In stock
243,The Long Haul (Diary of a Wimpy Kid #9),the-long-haul-diary-of-a-wimpy-kid-9_757/index.html,44.07,In stock
244,The Loney,the-loney_756/index.html,23.40,In stock
245,The Literature Book (Big Ideas Simply Explained),the-literature-book-big-ideas-simply-explained_755/index.html,17.43,In stock
246,The Last Mile (Amos Decker #2),the-last-mile-amos-decker-2_754/index.html,54.21,In stock
247,The Immortal Life of Henrietta Lacks,the-immortal-life-of-henrietta-lacks_753/index.html,40.67,In stock
248,The Hidden Oracle (The Trials of Apollo #1),the-hidden-oracle-the-trials-of-apollo-1_752/index.html,52.26,In stock
249,The Help Yourself Cookbook for Kids: 60 Easy Plant-Based Recipes Kids Can Make to Stay Healthy and Save the Earth,the-help-yourself-cookbook-for-kids-60-easy-plant-based-recipes-kids-can-make-to-stay-healthy-and-save-the-earth_751/index.html,28.77,In stock
250,The Guilty (Will Robie #4),the-guilty-will-robie-4_750/index.html,13.82,In stock
251,The First Hostage (J.B. Collins #2),the-first-hostage-jb-collins-2_749/index.html,25.85,In stock
252,The Dovekeepers,the-dovekeepers_748/index.html,48.78,In stock
253,The Darkest Lie,the-darkest-lie_747/index.html,35.35,In stock
254,The Bane Chronicles (The Bane Chronicles #1-11),the-bane-chronicles-the-bane-chronicles-1-11_746/index.html,44.73,In stock
255,The Bad-Ass Librarians of Timbuktu: And Their Race to Save the World’s Most Precious Manuscripts,the-bad-ass-librarians-of-timbuktu-and-their-race-to-save-the-worlds-most-precious-manuscripts_745/index.html,15.77,In stock
256,The 14th Colony (Cotton Malone #11),the-14th-colony-cotton-malone-11_744/index.html,39.24,In stock
257,That Darkness (Gardiner and Renner #1),that-darkness-gardiner-and-renner-1_743/index.html,13.92,In stock
258,Tastes Like Fear (DI Marnie Rome #3),tastes-like-fear-di-marnie-rome-3_742/index.html,10.69,In stock
259,Take Me with You,take-me-with-you_741/index.html,45.21,In stock
260,Swell: A Year of Waves,swell-a-year-of-waves_740/index.html,45.58,In stock
261,Superman Vol. 1: Before Truth (Superman by Gene Luen Yang #1),superman-vol-1-before-truth-superman-by-gene-luen-yang-1_739/index.html,11.89,In stock
262,Still Life with Bread Crumbs,still-life-with-bread-crumbs_738/index.html,26.41,In stock
263,Steve Jobs,steve-jobs_737/index.html,39.50,In stock
264,Sorting the Beef from the Bull: The Science of Food Fraud Forensics,sorting-the-beef-from-the-bull-the-science-of-food-fraud-forensics_736/index.html,44.74,In stock
265,Someone Like You (The Harrisons #2),someone-like-you-the-harrisons-2_735/index.html,52.79,In stock
266,"So Cute It Hurts!!, Vol. 6 (So Cute It Hurts!! #6)",so-cute-it-hurts-vol-6-so-cute-it-hurts-6_734/index.html,35.43,In stock
267,Shtum,shtum_733/index.html,55.84,In stock
268,See America: A Celebration of Our National Parks & Treasured Sites,see-america-a-celebration-of-our-national-parks-treasured-sites_732/index.html,48.87,In stock
269,salt.,salt_731/index.html,46.78,In stock
270,Robin War,robin-war_730/index.html,47.82,In stock
271,"Red Hood/Arsenal, Vol. 1: Open for Business (Red Hood/Arsenal #1)",red-hoodarsenal-vol-1-open-for-business-red-hoodarsenal-1_729/index.html,25.48,In stock
272,Rain Fish,rain-fish_728/index.html,23.57,In stock
273,"Quarter Life Poetry: Poems for the Young, Broke and Hangry",quarter-life-poetry-poems-for-the-young-broke-and-hangry_727/index.html,50.89,In stock
274,Pet Sematary,pet-sematary_726/index.html,10.56,In stock
275,"Overload: How to Unplug, Unwind, and Unleash Yourself from the Pressure of Stress",overload-how-to-unplug-unwind-and-unleash-yourself-from-the-pressure-of-stress_725/index.html,52.15,In stock
276,Once Was a Time,once-was-a-time_724/index.html,18.28,In stock
277,Old School (Diary of a Wimpy Kid #10),old-school-diary-of-a-wimpy-kid-10_723/index.html,11.83,In stock
278,No Dream Is Too High: Life Lessons From a Man Who Walked on the Moon,no-dream-is-too-high-life-lessons-from-a-man-who-walked-on-the-moon_722/index.html,21.95,In stock
279,"Naruto (3-in-1 Edition), Vol. 14: Includes Vols. 40, 41 & 42 (Naruto: Omnibus #14)",naruto-3-in-1-edition-vol-14-includes-vols-40-41-42-naruto-omnibus-14_721/index.html,38.39,In stock
280,My Name Is Lucy Barton,my-name-is-lucy-barton_720/index.html,41.56,In stock
281,My Mrs. Brown,my-mrs-brown_719/index.html,24.48,In stock
282,My Kind of Crazy,my-kind-of-crazy_718/index.html,40.36,In stock
283,Mr. Mercedes (Bill Hodges Trilogy #1),mr-mercedes-bill-hodges-trilogy-1_717/index.html,28.90,In stock
284,More Than Music (Chasing the Dream #1),more-than-music-chasing-the-dream-1_716/index.html,37.61,In stock
285,Made to Stick: Why Some Ideas Survive and Others Die,made-to-stick-why-some-ideas-survive-and-others-die_715/index.html,38.85,In stock
286,Luis Paints the World,luis-paints-the-world_714/index.html,53.95,In stock
287,Luckiest Girl Alive,luckiest-girl-alive_713/index.html,49.83,In stock
288,Lowriders to the Center of the Earth (Lowriders in Space #2),lowriders-to-the-center-of-the-earth-lowriders-in-space-2_712/index.html,51.51,In stock
289,Love Is a Mix Tape (Music #1),love-is-a-mix-tape-music-1_711/index.html,18.03,In stock
290,Looking for Lovely: Collecting the Moments that Matter,looking-for-lovely-collecting-the-moments-that-matter_710/index.html,29.14,In stock
291,"Living Leadership by Insight: A Good Leader Achieves, a Great Leader Builds Monuments",living-leadership-by-insight-a-good-leader-achieves-a-great-leader-builds-monuments_709/index.html,46.91,In stock
292,Let It Out: A Journey Through Journaling,let-it-out-a-journey-through-journaling_708/index.html,26.79,In stock
293,Lady Midnight (The Dark Artifices #1),lady-midnight-the-dark-artifices-1_707/index.html,16.28,In stock
294,"It's All Easy: Healthy, Delicious Weeknight Meals in under 30 Minutes",its-all-easy-healthy-delicious-weeknight-meals-in-under-30-minutes_706/index.html,19.55,In stock
295,Island of Dragons (Unwanteds #7),island-of-dragons-unwanteds-7_705/index.html,29.65,In stock
296,I Know What I'm Doing -- and Other Lies I Tell Myself: Dispatches from a Life Under Construction,i-know-what-im-doing-and-other-lies-i-tell-myself-dispatches-from-a-life-under-construction_704/index.html,25.98,In stock
297,I Am Pilgrim (Pilgrim #1),i-am-pilgrim-pilgrim-1_703/index.html,10.60,In stock
298,"Hyperbole and a Half: Unfortunate Situations, Flawed Coping Mechanisms, Mayhem, and Other Things That Happened",hyperbole-and-a-half-unfortunate-situations-flawed-coping-mechanisms-mayhem-and-other-things-that-happened_702/index.html,14.75,In stock
299,"Hush, Hush (Hush, Hush #1)",hush-hush-hush-hush-1_701/index.html,47.02,In stock
300,Hold Your Breath (Search and Rescue #1),hold-your-breath-search-and-rescue-1_700/index.html,28.82,In stock
301,Hamilton: The Revolution,hamilton-the-revolution_699/index.html,58.79,In stock
302,Greek Mythic History,greek-mythic-history_698/index.html,10.23,In stock
303,God: The Most Unpleasant Character in All Fiction,god-the-most-unpleasant-character-in-all-fiction_697/index.html,30.03,In stock
304,Glory over Everything: Beyond The Kitchen House,glory-over-everything-beyond-the-kitchen-house_696/index.html,45.84,In stock
305,Feathers: Displays of Brilliant Plumage,feathers-displays-of-brilliant-plumage_695/index.html,49.05,In stock
306,"Far & Away: Places on the Brink of Change: Seven Continents, Twenty-Five Years",far-away-places-on-the-brink-of-change-seven-continents-twenty-five-years_694/index.html,15.06,In stock
307,Every Last Word,every-last-word_693/index.html,46.47,In stock
308,Eligible (The Austen Project #4),eligible-the-austen-project-4_692/index.html,27.09,In stock
309,El Deafo,el-deafo_691/index.html,57.62,In stock
310,Eight Hundred Grapes,eight-hundred-grapes_690/index.html,14.39,In stock
311,"Eaternity: More than 150 Deliciously Easy Vegan Recipes for a Long, Healthy, Satisfied, Joyful Life",eaternity-more-than-150-deliciously-easy-vegan-recipes-for-a-long-healthy-satisfied-joyful-life_689/index.html,51.75,In stock
312,"Eat Fat, Get Thin",eat-fat-get-thin_688/index.html,54.07,In stock
313,Don't Get Caught,dont-get-caught_687/index.html,55.35,In stock
314,Doctor Sleep (The Shining #2),doctor-sleep-the-shining-2_686/index.html,40.12,In stock
315,Demigods & Magicians: Percy and Annabeth Meet the Kanes (Percy Jackson & Kane Chronicles Crossover #1-3),demigods-magicians-percy-and-annabeth-meet-the-kanes-percy-jackson-kane-chronicles-crossover-1-3_685/index.html,37.51,In stock
316,Dear Mr. Knightley,dear-mr-knightley_684/index.html,11.21,In stock
317,Daily Fantasy Sports,daily-fantasy-sports_683/index.html,36.58,In stock
318,Crazy Love: Overwhelmed by a Relentless God,crazy-love-overwhelmed-by-a-relentless-god_682/index.html,47.72,In stock
319,Cometh the Hour (The Clifton Chronicles #6),cometh-the-hour-the-clifton-chronicles-6_681/index.html,25.01,In stock
320,Code Name Verity (Code Name Verity #1),code-name-verity-code-name-verity-1_680/index.html,22.13,In stock
321,Clockwork Angel (The Infernal Devices #1),clockwork-angel-the-infernal-devices-1_679/index.html,44.14,In stock
322,City of Glass (The Mortal Instruments #3),city-of-glass-the-mortal-instruments-3_678/index.html,56.02,In stock
323,City of Fallen Angels (The Mortal Instruments #4),city-of-fallen-angels-the-mortal-instruments-4_677/index.html,11.23,In stock
324,City of Bones (The Mortal Instruments #1),city-of-bones-the-mortal-instruments-1_676/index.html,43.28,In stock
325,City of Ashes (The Mortal Instruments #2),city-of-ashes-the-mortal-instruments-2_675/index.html,47.27,In stock
326,Cell,cell_674/index.html,20.29,In stock
327,Catching Jordan (Hundred Oaks),catching-jordan-hundred-oaks_673/index.html,50.83,In stock
328,"Carry On, Warrior: Thoughts on Life Unarmed",carry-on-warrior-thoughts-on-life-unarmed_672/index.html,31.85,In stock
329,Carrie,carrie_671/index.html,46.23,In stock
330,Buying In: The Secret Dialogue Between What We Buy and Who We Are,buying-in-the-secret-dialogue-between-what-we-buy-and-who-we-are_670/index.html,37.80,In stock
331,Brain on Fire: My Month of Madness,brain-on-fire-my-month-of-madness_669/index.html,49.32,In stock
332,Batman: Europa,batman-europa_668/index.html,32.01,In stock
333,Barefoot Contessa Back to Basics,barefoot-contessa-back-to-basics_667/index.html,28.01,In stock
334,Barefoot Contessa at Home: Everyday Recipes You'll Make Over and Over Again,barefoot-contessa-at-home-everyday-recipes-youll-make-over-and-over-again_666/index.html,50.62,In stock
335,Balloon Animals,balloon-animals_665/index.html,17.03,In stock
336,Art Ops Vol. 1,art-ops-vol-1_664/index.html,48.80,In stock
337,Aristotle and Dante Discover the Secrets of the Universe (Aristotle and Dante Discover the Secrets of the Universe #1),aristotle-and-dante-discover-the-secrets-of-the-universe-aristotle-and-dante-discover-the-secrets-of-the-universe-1_663/index.html,58.14,In stock
338,Angels Walking (Angels Walking #1),angels-walking-angels-walking-1_662/index.html,34.20,In stock
339,Angels & Demons (Robert Langdon #1),angels-demons-robert-langdon-1_661/index.html,51.48,In stock
340,All the Light We Cannot See,all-the-light-we-cannot-see_660/index.html,29.87,In stock
341,"Adulthood Is a Myth: A ""Sarah's Scribbles"" Collection",adulthood-is-a-myth-a-sarahs-scribbles-collection_659/index.html,10.90,In stock
342,Abstract City,abstract-city_658/index.html,56.37,In stock
343,A Time of Torment (Charlie Parker #14),a-time-of-torment-charlie-parker-14_657/index.html,48.35,In stock
344,A Study in Scarlet (Sherlock Holmes #1),a-study-in-scarlet-sherlock-holmes-1_656/index.html,16.73,In stock
345,"A Series of Catastrophes and Miracles: A True Story of Love, Science, and Cancer",a-series-of-catastrophes-and-miracles-a-true-story-of-love-science-and-cancer_655/index.html,56.48,In stock
346,A People's History of the United States,a-peoples-history-of-the-united-states_654/index.html,40.79,In stock
347,A Man Called Ove,a-man-called-ove_653/index.html,39.72,In stock
348,A Distant Mirror: The Calamitous 14th Century,a-distant-mirror-the-calamitous-14th-century_652/index.html,14.58,In stock
349,A Brush of Wings (Angels Walking #3),a-brush-of-wings-angels-walking-3_651/index.html,55.51,In stock
350,1491: New Revelations of the Americas Before Columbus,1491-new-revelations-of-the-americas-before-columbus_650/index.html,21.80,In stock
351,"The Three Searches, Meaning, and the Story",the-three-searches-meaning-and-the-story_649/index.html,13.33,In stock
352,Searching for Meaning in Gailana,searching-for-meaning-in-gailana_648/index.html,38.73,In stock
353,Rook,rook_647/index.html,37.86,In stock
354,My Kitchen Year: 136 Recipes That Saved My Life,my-kitchen-year-136-recipes-that-saved-my-life_646/index.html,11.53,In stock
355,13 Hours: The Inside Account of What Really Happened In Benghazi,13-hours-the-inside-account-of-what-really-happened-in-benghazi_645/index.html,27.06,In stock
356,Will You Won't You Want Me?,will-you-wont-you-want-me_644/index.html,13.86,In stock
357,Tipping Point for Planet Earth: How Close Are We to the Edge?,tipping-point-for-planet-earth-how-close-are-we-to-the-edge_643/index.html,37.55,In stock
358,The Star-Touched Queen,the-star-touched-queen_642/index.html,32.30,In stock
359,The Silent Sister (Riley MacPherson #1),the-silent-sister-riley-macpherson-1_641/index.html,46.29,In stock
360,The Midnight Watch: A Novel of the Titanic and the Californian,the-midnight-watch-a-novel-of-the-titanic-and-the-californian_640/index.html,26.20,In stock
361,The Lonely City: Adventures in the Art of Being Alone,the-lonely-city-adventures-in-the-art-of-being-alone_639/index.html,33.26,In stock
362,The Gray Rhino: How to Recognize and Act on the Obvious Dangers We Ignore,the-gray-rhino-how-to-recognize-and-act-on-the-obvious-dangers-we-ignore_638/index.html,59.15,In stock
363,The Golden Condom: And Other Essays on Love Lost and Found,the-golden-condom-and-other-essays-on-love-lost-and-found_637/index.html,39.43,In stock
364,The Epidemic (The Program 0.6),the-epidemic-the-program-06_636/index.html,14.44,In stock
365,The Dinner Party,the-dinner-party_635/index.html,56.54,In stock
366,The Diary of a Young Girl,the-diary-of-a-young-girl_634/index.html,59.90,In stock
367,The Children,the-children_633/index.html,11.88,In stock
368,Stars Above (The Lunar Chronicles #4.5),stars-above-the-lunar-chronicles-45_632/index.html,48.05,In stock
369,Snatched: How A Drug Queen Went Undercover for the DEA and Was Kidnapped By Colombian Guerillas,snatched-how-a-drug-queen-went-undercover-for-the-dea-and-was-kidnapped-by-colombian-guerillas_631/index.html,21.21,In stock
370,Raspberry Pi Electronics Projects for the Evil Genius,raspberry-pi-electronics-projects-for-the-evil-genius_630/index.html,49.67,In stock
371,Quench Your Own Thirst: Business Lessons Learned Over a Beer or Two,quench-your-own-thirst-business-lessons-learned-over-a-beer-or-two_629/index.html,43.14,In stock
372,Psycho: Sanitarium (Psycho #1.5),psycho-sanitarium-psycho-15_628/index.html,36.97,In stock
373,Poisonous (Max Revere Novels #3),poisonous-max-revere-novels-3_627/index.html,26.80,In stock
374,One with You (Crossfire #5),one-with-you-crossfire-5_626/index.html,15.71,In stock
375,No Love Allowed (Dodge Cove #1),no-love-allowed-dodge-cove-1_625/index.html,54.65,In stock
376,Murder at the 42nd Street Library (Raymond Ambler #1),murder-at-the-42nd-street-library-raymond-ambler-1_624/index.html,54.36,In stock
377,Most Wanted,most-wanted_623/index.html,35.28,In stock
378,"Love, Lies and Spies",love-lies-and-spies_622/index.html,20.55,In stock
379,How to Speak Golf: An Illustrated Guide to Links Lingo,how-to-speak-golf-an-illustrated-guide-to-links-lingo_621/index.html,58.32,In stock
380,Hide Away (Eve Duncan #20),hide-away-eve-duncan-20_620/index.html,11.84,In stock
381,Furiously Happy: A Funny Book About Horrible Things,furiously-happy-a-funny-book-about-horrible-things_619/index.html,41.46,In stock
382,Everyday Italian: 125 Simple and Delicious Recipes,everyday-italian-125-simple-and-delicious-recipes_618/index.html,20.10,In stock
383,Equal Is Unfair: America's Misguided Fight Against Income Inequality,equal-is-unfair-americas-misguided-fight-against-income-inequality_617/index.html,56.86,In stock
384,Eleanor & Park,eleanor-park_616/index.html,56.51,In stock
385,Dirty (Dive Bar #1),dirty-dive-bar-1_615/index.html,40.83,In stock
386,Can You Keep a Secret? (Fear Street Relaunch #4),can-you-keep-a-secret-fear-street-relaunch-4_614/index.html,48.64,In stock
387,Boar Island (Anna Pigeon #19),boar-island-anna-pigeon-19_613/index.html,59.48,In stock
388,A Paris Apartment,a-paris-apartment_612/index.html,39.01,In stock
389,"A la Mode: 120 Recipes in 60 Pairings: Pies, Tarts, Cakes, Crisps, and More Topped with Ice Cream, Gelato, Frozen Custard, and More",a-la-mode-120-recipes-in-60-pairings-pies-tarts-cakes-crisps-and-more-topped-with-ice-cream-gelato-frozen-custard-and-more_611/index.html,38.77,In stock
390,Troublemaker: Surviving Hollywood and Scientology,troublemaker-surviving-hollywood-and-scientology_610/index.html,48.39,In stock
391,The Widow,the-widow_609/index.html,27.26,In stock
392,"The Sleep Revolution: Transforming Your Life, One Night at a Time",the-sleep-revolution-transforming-your-life-one-night-at-a-time_608/index.html,11.68,In stock
393,The Improbability of Love,the-improbability-of-love_607/index.html,59.45,In stock
394,The Art of Startup Fundraising,the-art-of-startup-fundraising_606/index.html,21.00,In stock
395,Take Me Home Tonight (Rock Star Romance #3),take-me-home-tonight-rock-star-romance-3_605/index.html,53.98,In stock
396,Sleeping Giants (Themis Files #1),sleeping-giants-themis-files-1_604/index.html,48.74,In stock
397,"Setting the World on Fire: The Brief, Astonishing Life of St. Catherine of Siena",setting-the-world-on-fire-the-brief-astonishing-life-of-st-catherine-of-siena_603/index.html,21.15,In stock
398,Playing with Fire,playing-with-fire_602/index.html,13.71,In stock
399,Off the Hook (Fishing for Trouble #1),off-the-hook-fishing-for-trouble-1_601/index.html,47.67,In stock
400,Mothering Sunday,mothering-sunday_600/index.html,13.34,In stock
401,"Mother, Can You Not?",mother-can-you-not_599/index.html,16.89,In stock
402,M Train,m-train_598/index.html,27.18,In stock
403,Lilac Girls,lilac-girls_597/index.html,17.28,In stock
404,Lies and Other Acts of Love,lies-and-other-acts-of-love_596/index.html,45.14,In stock
405,Lab Girl,lab-girl_595/index.html,40.85,In stock
406,Keep Me Posted,keep-me-posted_594/index.html,20.46,In stock
407,It Didn't Start with You: How Inherited Family Trauma Shapes Who We Are and How to End the Cycle,it-didnt-start-with-you-how-inherited-family-trauma-shapes-who-we-are-and-how-to-end-the-cycle_593/index.html,56.27,In stock
408,Grey (Fifty Shades #4),grey-fifty-shades-4_592/index.html,48.49,In stock
409,"Exit, Pursued by a Bear",exit-pursued-by-a-bear_591/index.html,51.34,In stock
410,Daredevils,daredevils_590/index.html,16.34,In stock
411,Cravings: Recipes for What You Want to Eat,cravings-recipes-for-what-you-want-to-eat_589/index.html,20.50,In stock
412,Born for This: How to Find the Work You Were Meant to Do,born-for-this-how-to-find-the-work-you-were-meant-to-do_588/index.html,21.59,In stock
413,Arena,arena_587/index.html,21.36,In stock
414,Adultery,adultery_586/index.html,20.88,In stock
415,A Mother's Reckoning: Living in the Aftermath of Tragedy,a-mothers-reckoning-living-in-the-aftermath-of-tragedy_585/index.html,19.53,In stock
416,A Gentleman's Position (Society of Gentlemen #3),a-gentlemans-position-society-of-gentlemen-3_584/index.html,14.75,In stock
417,11/22/63,112263_583/index.html,48.48,In stock
418,"10% Happier: How I Tamed the Voice in My Head, Reduced Stress Without Losing My Edge, and Found Self-Help That Actually Works",10-happier-how-i-tamed-the-voice-in-my-head-reduced-stress-without-losing-my-edge-and-found-self-help-that-actually-works_582/index.html,24.57,In stock
419,10-Day Green Smoothie Cleanse: Lose Up to 15 Pounds in 10 Days!,10-day-green-smoothie-cleanse-lose-up-to-15-pounds-in-10-days_581/index.html,49.71,In stock
420,Without Shame,without-shame_580/index.html,48.27,In stock
421,Watchmen,watchmen_579/index.html,58.05,In stock
422,Unlimited Intuition Now,unlimited-intuition-now_578/index.html,58.87,In stock
423,Underlying Notes,underlying-notes_577/index.html,11.82,In stock
424,The Shack,the-shack_576/index.html,28.03,In stock
425,The New Brand You: Your New Image Makes the Sale for You,the-new-brand-you-your-new-image-makes-the-sale-for-you_575/index.html,44.05,In stock
426,"The Moosewood Cookbook: Recipes from Moosewood Restaurant, Ithaca, New York",the-moosewood-cookbook-recipes-from-moosewood-restaurant-ithaca-new-york_574/index.html,12.34,In stock
427,The Flowers Lied,the-flowers-lied_573/index.html,16.68,In stock
428,"The Fabric of the Cosmos: Space, Time, and the Texture of Reality",the-fabric-of-the-cosmos-space-time-and-the-texture-of-reality_572/index.html,55.91,In stock
429,The Book of Mormon,the-book-of-mormon_571/index.html,24.57,In stock
430,The Art and Science of Low Carbohydrate Living,the-art-and-science-of-low-carbohydrate-living_570/index.html,52.98,In stock
431,The Alien Club,the-alien-club_569/index.html,54.40,In stock
432,Suzie Snowflake: One beautiful flake (a self-esteem story),suzie-snowflake-one-beautiful-flake-a-self-esteem-story_568/index.html,54.81,In stock
433,Nap-a-Roo,nap-a-roo_567/index.html,25.08,In stock
434,"NaNo What Now? Finding your editing process, revising your NaNoWriMo book and building a writing career through publishing and beyond",nano-what-now-finding-your-editing-process-revising-your-nanowrimo-book-and-building-a-writing-career-through-publishing-and-beyond_566/index.html,10.41,In stock
435,Modern Day Fables,modern-day-fables_565/index.html,47.44,In stock
436,If I Gave You God's Phone Number....: Searching for Spirituality in America,if-i-gave-you-gods-phone-number-searching-for-spirituality-in-america_564/index.html,20.91,In stock
437,"Fruits Basket, Vol. 9 (Fruits Basket #9)",fruits-basket-vol-9-fruits-basket-9_563/index.html,33.95,In stock
